title,author,subreddit,score,created_utc,num_comments,selftext,comments
Passed OSCP+ on first attempt! (70/110pts),twixter07,oscp,74,1731035736.0,14,"This was the wildest roller coaster of a test I’ve ever taken. I just got the email that I passed today. It took about 44 hours to hear back after submitting the report whether I passed or not. Someone on here said to check the “exam” tab in your PEN-200 dashboard because they show if you pass there sooner than they email and this was actually true for me. I purchased the learn one year subscription about 11 months ago and honestly, I did not lock in my studying until about 3 months before. This was a mistake as I could have gotten a lot more practice and been more prepared. For labs I ended up only doing OSCP A B C (some hints were needed) and Secura, and like 3 PG machines. This was also likely a mistake. I did not do a practice report for OSCP A B C or treat them like mock exams. I just used the OffSec template for the real report. I had some experience with pen testing knowledge and tools from my GPEN certification and some very inconsistent HTB usage a long time ago. I’ve also watched a TON of ippsec videos. I think this alone is why I was able to get away with such little lab practice. I had a pretty solid baseline which helped a lot. Most of the PEN-200 material I was already familiar with, and I only ended up completing 50% of the course. Thats not to say it was not valuable however. This is my first OSCP attempt so I don’t know about the old AD, but this new AD with partial points was my life saver. I would not have passed without this change. Here’s a rough timeline of my experience: 4PM: Started the exam, got my VPN files and dashboard and such. I had some trouble figuring out how to share both my screens with the proctor so in reality I probably started at like 4:15PM. Make sure you log in 15 minutes early at least. 6:15PM: By around 6ish I had already obtained 2 local proof.txts from the AD, securing 20 points. I was feeling great. All that was left was the domain admin. 6:30PM-01:00AM: The despair kicks in. I had been spinning my wheels for so long on the last part of the AD. When I would spend too much time stuck on the final AD machine I would go do a little bit of work here and there on the standalones. I felt pretty defeated because I went this whole 7 hours pretty much making 0 progress not even getting a foothold on any standalones. I ended up going to bed being sure I was about to fail. 7:30AM: Woke up and ate a protein bar, then started back up again. I was 99% sure I had figured out the path for this standalone the night before but could not get it to work. I tried it again in the morning and it just worked magically. Not sure what happened here. The privesc came a few hours after and only worked after about my third try. Lesson here is don’t give up if it doesn’t work the first time. Research backups to your exploits/tools incase one of them fails you can confirm it’s not a fluke with another version. ~11:30AM: Started working on the second standalone. Due to good enumeration I figured out the foothold quite quickly. Manual enumeration is and always will be key. Got stuck in a rabbit whole for a while but finally got the privesc. ~1:30PM: I had about 2 hours left and realized I only needed one more flag. I was freaking out internally because I didn’t think I could actually do this. I never went back to the last AD machine and instead focused on the final standalone that I had been putting off. I was so lost and so nervous and didn’t have much time. I eventually found it and realized it was so much simpler than I was making it. And by golly what do you know, I had enough flags for 70 points by about 3pm, with one hour remaining. Huzzah. 3PM-4PM: Used the last hour to frantically make sure I screenshotted EVERYTHING and did NOT mess up my proof.txt/local.txt screenshots. PLEASE double check your screenshots because I went back through and realized I did not capture the local.txt in one of my screenshots and only the ipconfig. Imagine if I had failed because of that. My score was as follows: 2 AD Proof.txt: 20 points 3 Stanadlone Local.txt: 30 points 2 Standalone Proof.txt: 20 points Total: 70 points Here’s a list of some resources that came in super handy during my prep and during the exam: ippsec.rocks website - anytime I needed to remember how to do something specific or saw a technology/platform I wasn’t familiar with, I just went on over to ippsec.rocks and typed it in, often times he was extremely helpful. It’s quite likely you’ll spend a lot of time googling/researching during the exam and ippsec can save a lot of time when you see something you’re unfamiliar with. It’s no secret this guy is a legend. https://youtube.com/playlist?list=PLT08J44ErMmb9qaEeTYl5diQW6jWVHCR2&si=IgWyM3CLy9F6z4Kv - I watched this guy’s 3 OSCP Active Directory attack paths religiously the weeks before my exam. Definitely watch these and take notes. Follow along with his setup tutorial and set up the lab for yourself if you’re up to it. Incredible resource imo. https://eins.li/posts/oscp-secret-sauce/ - I saw someone else recommend this resource here and wow, the small tips and tricks here go a long way. Particularly the busybox reverse shell being so consistent and the Mimikatz one liner are super useful and just small things that make life easier/save time. https://github.com/crazywifi/Enable-RDP-One-Liner-CMD - Any time I needed to enable RDP on a box I had this up. Don’t forget you can use RDP. It makes life a lot easier/quicker when interacting with your target and can establish persistence. It’s not like it’s a real engagement so who cares, definitely use this if it makes your life easier. https://www.revshells.com - Amazing site I wish I’d known about sooner honestly. Easily and quickly generate reverse shell one liners in just about any format imaginable. During my practice the most consistent for me on windows was the powershell base64 one and the busybox netcat for Linux. Final advice: SCREENSHOT EVERYTHING! If it’s a command you ran to exploit something just screenshot it. You can always decide what is and isn’t needed after you start the report. But once that exam portion is over there’s no going back to get new screenshots, your lab access is ripped away. So make sure you got what you need before that 24 hours is up. Screenshot every exploit output and step along the way. I used CherryTree for my notes and had a section under each machine where I just spammed screenshots, and during my report I would pick and choose which ones I needed. Remember that everything is designed to be quite trivial to exploit. Don’t overcomplicate things. The answer is usually simpler than you think. You got this!",traditionalcraft congratulations man simplyzinba whats background many hours daily reference much study necessary pramathu congratulations mate enjoy success questions experience starting pen ippsec videos helpful thanks advance bugsbunny congratulations bro thanks info volsurfer enjoyed reading thank tips resources congrats passing variouslavishness congratulations many thanks tips mecalpha congratulations really helpful ii going appear january cyberwatxer congrats man thank resources shared polygraphnet well done anonymoushere congrats pass one first pass oscp iksweetthefirefly congratulations internationaltoad great write thank congrats strikingcomputer congratulations man quite relate time wastage thing started months mine th thanks lot resources
Cloudflare to EU: Anti-Piracy Measures Shouldn't Harm Privacy and Security,ardi62,privacy,43,1731038593.0,1,,fibrettpremises pot meet kettle
The West must respond to Russia’s rapidly escalating hybrid warfare,Barch3,ActiveMeasures,103,1731021636.0,12,,kevans electing putins pawn good job america lwgman silent coup within us plutocracy continue keep wheels letting everyone sister continue ratfuck brainfuck us population cia fall russian collusion must new pearl harbor mission accomplished numberframer honestly starting look way aside dump already elon fucking musk learned direct line putin appears set installed wrecking ball theyve literally told us flat plan crash economy selling magats temporary discomfort real recovery supposedly takes place ill admit ponderings election night voting machines maybe hacked major media outlets fed disinfo returns realized sounded one decided bed time couple days still feeling right even fair square victory illogicallogical wasnt fair election rat fucked fact want fuck election rig vote counting fill enough heads enough disinformation russia interfered caught redhanded guarantee though tip iceberg coming corruption doj next administration well never find rest blueruin crazy dude something doesnt feel right afraid say anything want sound one many us feeling something cicknobb ive saying thing warichnochnie fair square legal sense trump genuinely received votes harris way electoral college blatantly obvious pervasive effective rightwing russian disinformation social alternative media major factor election going way dems start playing dirty reps eminence grise right fearmongered last decade two shameless trump fuck else gonna work point sweetcheekz hear ya lot e voting systems backed paper bacterialick bit late publish eh klappinmcboodycheeks would mattered unfortunately homey disagree everyone also acknowledge russias tactics found receptive audience american public bitter pill swallow large part voting public racist misogynistic interested democracy extremely wealthy families koch johnson mellon working towards decades want create kind unregulated notax serfdom ilkunfortunately wacky conspiracy theory great book anne nelson called shadow network subjecta rather depressing disturbing read quite insightful shadow network offers lesson american rights mastery politics leckysoup correction whats left west must respond russias rapidly escalating hybrid warfare
Received a disturbing ‘pickup duty’ text claiming they know my location—anyone else?,Fast-Thought-7670,Scams,2103,1730958272.0,62,"Hi everyone, I got a really disturbing text from a local area code that said, ‘Hello, you have been selected for pickup. We will come by at 12:00 Thursday. Don’t try to run—we know where you live.’ It’s unsettling because it came from my area code, and one of my friends got a similar text from a different area code with the same message about being picked up. Is this some sort of prank or scam going around? Any advice on how to handle this or reassurance would be really appreciated. Thanks!",ufastthought message posted new submissions rscams please message new users beware posted start getting private messages saying professional hacker recovery expert lawyer help get money back small fee call recovery never take private always come form comments post open community keep eye take private reminder rules rscams contact information including last names phone numbers etc civil one another name calling insults personal army requests scammerscambaiting posts permitted uncensored gore personal photographs allowed without blurring full list rules available sidebar clicking help us reporting recovery rulebreaking content report button review reports also consider warning community members recovery see comments questions rules send us modmail clicking bot action performed automatically please contact questions concerns awayindustry sigh let leave note petsitter kfkjhgfd likely prank troll fastthought wilddd theyre weird nogas saw one today fastthought oh happening everyone wtf thispartyrules probably somebody bought list registered democrats phone numbers kind use text canvassing registered independent political spam text messages sides ghboyette executive slave feel settled whatever theyd give ariadnestring report fbi winnieshortcake would block number fastthought playernine never reply even joke messages arent attempts theyre often used confirm number active valid ignore stay safe fastthought blocked yea aware na removed fastthought bye ur funny niamhara time abduction late scamsmodteam submission manually removed moderator following reason rule spam joke place useful informative discussions scams allow unhelpful content jokes serious posts sarcasm even obvious tagged since construed harmful anything related discussed please keep content submitted useful relevant meaningful posting sure review rules believe mistake feel free contact via modmail modmail way send regular dm single moderator please try appeal decision commenting notified probably miss posting exact thing may result temporary ban please review rules necessary changes doubt click appeal decision bot action performed manually please contact want appeal decision fuzzykittynomnom caller id easily frequently spoofed many nigerian assuming spam calls come area code ignore stmuerte saw twincities seems starting thing info post someone else another state text workingonit first gonna spend minutes typing reasons trust desirable trafficking victim secondly even somehow wanted deal trafficking stable adult westerner would warn advance go police waiting gun idiot either pranking maybe trying get money ignore move life would probably love message shits giggles usrdef least theyre polite hey kidnapped sold slave mark thursday calendar rsvp dutchtincan oh please well since asking nicely send btc well find somebody else kidnap theviewer meanwhile audience gigles thechimeranhybrid op desirable racist stormdust stable adult westerner riiiight lonelyoctopus local b racist means intent scared b angry two biggest motivations respond anything social media zuck proved fb reaction emojis entire internet electric theatre hate whoever sent trying provoke respond proves number active begin block report junk reply forget enjoy day styckx sounds prank googled various parts text results fastthought bye scary tho live area friend school also give number people pghguy probably didnt come anywhere near numbers spoofed look local number ive heard reports ignorant bullying threats today block worry usrdef block number sounds ridiculous almost started laugh sounds damn prank feel actually serious reach government law enforcement agency whoever nothing else townandthecity happening elsewhere across country someone state sub posted black friend receiving note similar specific localized picked space local number cant confirm chatter sub fbi aware asking people contact receive messages kgmara wouldnt even chance block report police norcalhal probably tony cartel escort business slow lately hes trying expand regular old slavery without sex na removed na removed scamsmodteam submission manually removed moderator following reason rule uncivil toxic behaviour aligned reddit content policy rule remember human place civil respectful discussions scams allow uncivil rude behavior excessive directed swearing unnecessary sexual language victim blaming form discrimination posting sure review rules reddit content policy believe mistake feel free contact via modmail modmail way send regular dm single moderator please try appeal decision commenting notified probably miss posting exact thing may result temporary ban please review rules necessary changes doubt click appeal decision bot action performed manually please contact want appeal decision fastthought wild blocked scamsmodteam submission manually removed moderator following reason rule uncivil toxic behaviour aligned reddit content policy rule remember human place civil respectful discussions scams allow uncivil rude behavior excessive directed swearing unnecessary sexual language victim blaming form discrimination posting sure review rules reddit content policy believe mistake feel free contact via modmail modmail way send regular dm single moderator please try appeal decision commenting notified probably miss posting exact thing may result temporary ban please review rules necessary changes doubt click appeal decision bot action performed manually please contact want appeal decision mintyfresh ignore contact na removed scamsmodteam submission manually removed moderator following reason rule scambaiting place learn scams allow scambaiting trying waste time discussions scamming engaging known scammer generally consider interactions unsafe time better spent educating community scams posting sure review rules believe mistake feel free contact via modmail modmail way send regular dm single moderator please try appeal decision commenting notified probably miss posting exact thing may result temporary ban please review rules necessary changes doubt click appeal decision bot action performed manually please contact want appeal decision na removed scamsmodteam submission manually removed moderator following reason rule spam joke place useful informative discussions scams allow unhelpful content jokes serious posts sarcasm even obvious tagged since construed harmful anything related discussed please keep content submitted useful relevant meaningful posting sure review rules believe mistake feel free contact via modmail modmail way send regular dm single moderator please try appeal decision commenting notified probably miss posting exact thing may result temporary ban please review rules necessary changes doubt click appeal decision bot action performed manually please contact want appeal decision fastthought townandthecity people obnoxiously dismissive comment happening across country people media picked already also want say sorry experiencing ariadnestring completely agreed messages reported fbi theres nothing funny let pranksters explain fbi theyre us case might dutchtincan dismissive either prank another people whore gullible sell sand desert theyll wait reply pleading kidnapped theyll tell somebody already paid cant show empty handed alas pay small sum safety somebody else orders kidnapping happy meal waiting bought eaten umamifiend wants gloat election question coming someone likely someone wants freak block noad cant take seriously na removed scamsmodteam submission manually removed moderator following reason rule scambaiting place learn scams allow scambaiting trying waste time discussions scamming engaging known scammer generally consider interactions unsafe time better spent educating community scams posting sure review rules believe mistake feel free contact via modmail modmail way send regular dm single moderator please try appeal decision commenting notified probably miss posting exact thing may result temporary ban please review rules necessary changes doubt click appeal decision bot action performed manually please contact want appeal decision na removed fastthought u wrong scamsmodteam submission manually removed moderator following reason rule spam joke place useful informative discussions scams allow unhelpful content jokes serious posts sarcasm even obvious tagged since construed harmful anything related discussed please keep content submitted useful relevant meaningful posting sure review rules believe mistake feel free contact via modmail modmail way send regular dm single moderator please try appeal decision commenting notified probably miss posting exact thing may result temporary ban please review rules necessary changes doubt click appeal decision bot action performed manually please contact want appeal decision thicktitle found another post seems antitrump election campaigning wild strategy though na removed scamsmodteam submission manually removed moderator following reason rule spam joke place useful informative discussions scams allow unhelpful content jokes serious posts sarcasm even obvious tagged since construed harmful anything related discussed please keep content submitted useful relevant meaningful posting sure review rules believe mistake feel free contact via modmail modmail way send regular dm single moderator please try appeal decision commenting notified probably miss posting exact thing may result temporary ban please review rules necessary changes doubt click appeal decision bot action performed manually please contact want appeal decision highlorduther bit early post
Germany arrests US citizen suspected of offering military intel to China,Strongbow85,craftofintelligence,65,1731026001.0,0,,
Germany arrests US citizen suspected of offering military intel to China,Strongbow85,espionage,57,1731026020.0,0,,
Out of Fortune500 companies only 4% have security.txt file,unihilists,cybersecurity,173,1731003004.0,26,"Experiment shows that only 21 companies of the Fortune500 operate ""/.well-known/security.txt"" file Source: https://x.com/repa_martin/status/1854559973834973645",metrobart requirement nist soc iso framework standard rfc entirely voluntary surprise askwhynotnotwhy requirement nist soc iso framework standard rfc entirely voluntary surprise fairness nist iso x address level detail designed soc espouse requirements framework output various auditing standards ssae holds primacygenerally simply audit controls company service organization says place antranigv cert care much bug bounty part securitytxt rather contact details many times learned websiteorg breached contact luck charleswj websiteorg breached contact luck probably deleted securitytxt amthehobo use fortune companies example likely securitytxt delete begin charleswj foreignmaybe ahh yes internet standard spamming companies bug bounty program beg bounties value findings dingledangletangle always love getting emails security researcher critical finding company finding something domain missing xframeoptions header feel free send money paypal intelwzard called beg bounty dufflimey itrabbit worked ecommerce website company suggested put simple text document websites director didnt want encourage bad guys less months later breached understand point view however site online white hat hackers secure give reward vulnerability hacked telerik cost us way money damages consulting costs auditors etc rdnn associated rfc also accepted ietf april blink eye really haltingproblems bug bounty program going regret one nothing bug beg beg bounties one place worked ecommerce securitytxt years two findings value still significantly low risk would get multiple reports month waste time investigating serious way encourage responsible disclosure open risk almost cases reporter wants bounty pay ignore could go public sell exploit chance patch also issue legality making payment entities also could way get access security team start performing recon ops simple honest idea heart reflect reality people report security findings good heart days incredibly rare user stumble upon security issue proper way bug bounty program securitytxt scope report findings sny put contact mailtosecurityexamplecom encryption acknowledgements policy bug bounty congratulations youve found bug submit valid vulnerability report might rewarded one finest treasures mcdonalds coupon book yep superlative pages filled dreams free fries dollarmenu delights subject availability limited quantities mood particularly horrendous bugs may even throw extra packet ketchup expires tz againi recovering server rd time todayhmm haltingproblems id hitting server hard deal sny yeah well point bounty inadvertently drawn attention tao state actors ill give preferential treatment though sqooky hilarious might even put cron update expiration todays date instead year end sny hey understand fomo well anyone bitslammer blame lawyers markuta similar research ago also wrote little securitytxt parser tool blog post available doubt much changed last two years lolklolk fortune retailer roadmap next quarter implemented mtasts two months ago well zookee set one two valid reports problem email scraped used kinds spammers emails junk email folder almost always email intelwzard really one requirement even real standard ever adopted sadly people people could easily find another way hunt point contact really needed ptear improving help streamline bitcoin payments topdeliverability differing opinions usefulness securitytxt file see negative recommend following clearly indicate bug bounty program use dedicated mailbox alias filter crap hunglowbungalow okay number f without bb program
