title,author,subreddit,score,created_utc,num_comments,selftext,comments
Accenture vs. Crowdstrike,KingRudy25,cybersecurity,29,1731006646.0,85,"Hello all, I am looking for your takes on this. I was offered a full time SOC analyst role with Accenture and also an Internship Opportunity with Crowdstrike as a Falcon Analyst. I haven't accepted either one yet and was wondering which would help me the most long term. My end goal is red team. With Accenture I'd have all the benefits of a full time job and with Crowdstrike I'd have an internship with the POSSIBILITY of a job, but also CrowdStrikes name on my resume. I'm just not sure which would be most beneficial long term as I can't have both because they have overlapping start dates. Give some feedback please!",mstymemries one ten people something good say accenture fjohurslykewwe would good statistic powerpoint slide rollingstone unicorn rogueshoten accenture guiltymastodon agreed seen sweat shop xx accidenture nakedspacecowboy worked msp cyber big sit wouldnt bad goal red team crowdstrike prob better experience canofspam crowdstrike job opportunities increase tenfold plus interns get hired stock fc team work life manageable sustainable accenture soc analyst fc actual remediation many pathways open threat hunting malware analysis de etc plus sans training great mentorship etzel hold even asking question op lawtechie crowdstrike people working accenture people want crowdstrike people wijnandsj accenture geographies tends treat junior people entirely disposable daddydj theyve since worked years ago france rd world country triairius debatable british person probably xelawella former crowdstrike falcon complete intern crowdstrike learn lot best people awesome networking opportunities intelwzard accenture outsourced trash bad rep stick crowdstrike imo look better resume wanna stay cyber stand time comes looks better offer position snatchymcgrabberson speaking former crowdstrike falcon complete manager stick crowdstrike shamelessrepentant former employee crowdstrike competitor would choose crowdstrike basiccorner internship thing isnt dealbreaker crowdstrike absolutely way interact accenture consultants crowdstrike ir folks daily would absolutely work cs teams day week avoid accenture folks much possible biblecrumble crowdstrike absolutely question westerniron crowdstrike literally jump starting career go best edr market crazy good training super smart people learn kingrudy op accept accentures offer work months move crowdstrike accenture would start jan cs wouldnt start summer wafflestomper bad plan downside could see someone questioning stayed accenture months however people would understand better opportunity cs id say prioritize cs accenture others pleasantdeal add months accenture resume sotisnuggzz came say madmorb fair warning accenture offers signing bonus outside coursestraining require pay back leave havent worked requisite period kingrudy ill run situation recruiter official offer want take look permanent hire great team suffer little yakitorispelling could xdoozyy wouldnt include time accenture resume money bad idea kingrudy money still want realworld experience id work minimum wage give school though real life doesnt start graduate xdoozyy go include months resume red flag kingrudy ask classify internship way still work still get paid could use school credit actually talk team lead every couple weeks maybe could happen drunkpolak going ask accenture internship wouldnt recommend hiring perspective likely budget set aside bring person manager needs use lose hr side probably whole new set paperwork knows even internshipshavent checked would never want experience take offer say anything work time quit go cs give signing bonus set aside speaking experience less say case try finesse better kingrudy going take leave simple break simple drunkpolak perfect try change itll either raise questions seem worth effort money work otherwise id take time focus cert blue team level worry working accenture youll get stress knowledge thejournalizer really worth burning bridge hands lot pies rollingstone crwd way theporko isnt accenture outsource company values sales gamewiz accenture yakitorispelling avoid accenture nicknamed assenter reason replayrreplay would want avoid lonelydig nice brwdr definitely crowdstrike company threat actor successfully shut many systems services small window time crowdstrike serious red team skill set solid resume padding accenture meat shop byronicbluez would go crowdstrike anything mssp related isnt looked fondly actually count people first hand majorstandards clowdstike ftw jwrig either way look resume accenture going better place work stuff crowdstrike ecosystem crowdstrike going position become expert technology ecosystem help land jobs either helping implementing crowdstrike crowdstrike youll work hard roles compensated well roles sanity pick job based company pick job based leader youll report benefit career company name resume prodsec crowdstrike verbalddos accenture llc accenture federal afs llc crowd strike way afs sponsor clearance winner long run thetarquin job hand worth pretty much internship imo youve industry years internships stop mattering entirely onthejob experience whats important oddsystem yeah makes hard crowd strike generally converts interns full time hires accenture sucks job right gate risk vs reward thing way many playing risk choice cause suffer internship doesnt convert op searching job afterwards personally would ask pay accenture cause work many places pay enough push back management anything unreasonable example recently told manager driving testing site get low level cert want talk getting cissp driving test company wants cover kingrudy pay k still college student plus live low cost city agrippa someone foot door consultancy go crowdstrike pay dividends career run compared another consultancy training often poor oddsystem yeah tough one k solid pay around places pay right curve graduates really question much risk willing take cause full time job crowdstrike would lot better risk doesnt convert full time leave awkward spot agrippa experience would worth far cs another run mill consultancy though assuming cs solid internship program bulbusmaximus crowdstrike going someplace accenture going stagnate suck everyone wants cool red team stuff experience crowdstrike allow pivot future treated meatbag brightad everyone wants work crowdstrike spacegoblinyoda crowdstrike hiring outside india huh canofspam fc us eu apac theenddaysarenow guys yes treat staff poorly daddydj going back years ago anonymous employee created web comic work accenture back still called andersen consulting called bigtime consulting renamed indenture andersen rebranded accenture great brutally realistic much andersen consulting tracked anonymous employee fired employee james sanchez sadly died heart attack back see original cartoons theenddaysarenow thank worked projects spiritedinflation crowdstrike hands thegreatbard accenture accidenture worked months good thing lot partnerships use vendor platforms learn id choose clownstrike anyway linuxheretic id go crowdstrike impressions ive gotten interactions accenture employees years paint pretty grim picture mourackb accenture powerpoint oriented company go want master ppt want evolve soc skills would pick crowdstrike mrtompeti take crowdstrike heheheh ironpeter direct experience accenture doesnt great reputation cyber developing young talents job vs internship say comparing apples apples countmcburney crowdstrike far perfect meat grinder accenture running go cs dwightdeisenschrute crowdstrike fool svmseric go crowdstrike oem experience consulting experience davidlowie accenture comes takes companies downsize dept outsource another country happened seems lame position spetsnazvimpel accenture lot upwards growth opportunities paid training certification want alienated consultancies always worse vendors business model though crowdstrike cog bigger machine nice machine pays great consultancy meat grinder one ten people happy thing pyramid scheme run best among peerscohort consultancy absolutely better vendor taking bigger risk though merredditor crowdstrike cooler internship unpaidunderpaid shouldnt work exposure kickvegans crowdstrike without doubt menacetwoosociety accenture name crappy company crappy people give damn another person replaceable consulting sucks cs learn trade tools stress management supershow crowdstrike look back graycorsatoru crowdstrike mate accenture culture wildy tragic likely crowdstrike internship could bounce back roles number businesses exp big accenture space rottensec crowdstrike people dancing desks twerk bunch parties go thatmagician seriously even consciouswedding go accenture crowdstrike best option career choose djmelli options recommend consulting firms c level dcryptrr hey op dm related celzo sure crowdstrike resume good bad thing one would never use products services weatheredrabbit bro accenture deloitte crowdstrike cliffy may start full time soc analyst accenture transfer open slot related cyber write regex cool hey build slides sales presentation oh since slides time move marketing hey well keep eye open soc role
ISSM Looking for advice ,NonceJ,SecurityCareerAdvice,3,1731014595.0,3,"Quick background: I have been an at this company as an ISSM for just over a year now. Did one year as an ISSO before starting here, and 10 years doing SA/NA type work. My boss works across the country and has limited insight at my location. I work with an FSO who tries to act as if he’s my boss. This has led to several communication issues between myself and leadership at the site. People constantly go to him for cybersecurity related issues assuming he is my manager. Recently the FSO asked me for a report, I said sure but what for, and he says it’s a meeting only for management. I manage a lot of projects and it’s a lot harder when I don’t have the information I need. I brought it up to him later and asked if it would be a good idea to get me involved in these types of meetings, he told me not to worry about it and it’s mostly programmatics. I guess I just feel like it’s hard to be a ISSM when you’re not treated like a manager. Wanted to see if anyone had input/advice on how to go about this. I’m also curious how much other ISSMs work with their FSOs, and if the dynamic is the same.",untrustedprocess org published org chart easy trace chain command dotted line relationships noncej yes shows report boss across country security protective services untrustedprocess take concerns include voicing concerns input locally examples causing negative business impacts
I tested NotebookLM with my collection of notes on D2 Asset Security. ,theirishwizard,cissp,3,1731041543.0,0,I tested out NotebookLM with a few data sources for D2 Asset Security. It created a audio blog between two Ai bots. Let me know what you guys think. It is blowing my mind up! https://notebooklm.google.com/notebook/7807bcd2-7d82-4203-83f2-ebd7d4a41f0a/audio,
Door-to-door stolen iPhone scam??,bali217,Scams,4,1731048238.0,3,"A few weeks ago, just after dark, a man and his middle-schoolish looking son knocked on the door. I had seen them walking up as I was working in the front room. I kept the screen door locked, but opened the interior door. They explained the kid lost his iPhone at a local theme park, and that find my phone was tracking it to a house on our block, which they showed me on the iPad. They also said the thief had taken a selfie with it, and showed me the pic and asked if I knew this person (who was wearing a shirt from the theme park, so presumably an employee). I said no, sorry, we’re anti-social and don’t really know our neighbors, but good luck. And they moved on. Tonight, again, just after dark, a different man knocked on the door, saying he lost his phone at the same theme park and it was tracking to our house (and showed us with a very old iPhone). My husband was like “no, we haven’t been there and we don’t have your iPhone, my wife said you came here before and it’s still the same answer, sorry.” And the guy was like ‘wait no, I’ve never been here?!’ I was listening from the other room and heard this was a different guy with a British accent. So I stepped in, said he was the second person to come by saying this, we don’t have the phone, if he wants to return with police we’d comply if they wanted to come look or something. I feel like this is shady, but I’m not sure how or why they would have the same story? Like are they friends, and this is the story they practiced to see if people are home? (Which we obviously were both times, as our office is well-lit and right in the front of our house) Or is there a thieving theme park worker in my neighborhood? Just trying to understand what the scam is and how it would work.",ubali message posted new submissions rscams please message new users beware posted start getting private messages saying professional hacker recovery expert lawyer help get money back small fee call recovery never take private always come form comments post open community keep eye take private reminder rules rscams contact information including last names phone numbers etc civil one another name calling insults personal army requests scammerscambaiting posts permitted uncensored gore personal photographs allowed without blurring full list rules available sidebar clicking help us reporting recovery rulebreaking content report button review reports also consider warning community members recovery see comments questions rules send us modmail clicking bot action performed automatically please contact questions concerns bacche particular lot doortodoor ones theyre scoping houses possible robbery
BlueNoroff Hidden Risk | Threat Actor Targets Macs with Fake Crypto News and Novel Persistence,digicat,blueteamsec,3,1731011256.0,0,,
From Networking to Security ,tochmoc,cybersecurity,47,1730995868.0,19,"Hello folks, I’m 26 years old, and I’m approaching the 3-year mark in my first and current role as a Network Engineer at an ISP. I’m now looking to transition from Networking to Cybersecurity. Has anyone here made a similar shift? If so, I’d love to hear about your experience and what kind of study or training you pursued. Is it challenging to land a job as a Security Analyst or a Network Security Engineer? Also, are any of you managers or business owners in the Security field who are hiring? If so, please let me know.",newtland made exact shift long time ago things still leaders space look stool legs understanding network dev cybersecurity youll find way bolster doesnt done previous making jump space easily start analyst soc email whatever others theyll done pending desired outcome one option many many paths broad strokes jump word hard find way fun dahra network security would easiest transition already fundamental building blocks firewalls entry point lot netsec tools learn ngfw idsips ndr ztna micro segmentation etc macb yup exactly network engineer started deploying firewalls started sure build system admin skills microsoft linux important understand works done etc extremeall guys netxorking best sysadmin close second xith developrs close place phoxey ask work replacement keyboard bro civilentrance good networking already security job firewalls segmentation encryption etc get cissp rebrand official infosec market picks kesshh years belt network matter right place right time quit job find next extra time current gig waste personally studying training detail current work experiences sure merely told seek understand impact design implementation choices able talk deeply work experience far superior able say told dead end top try put cybersecurity lens work determine affects things controls attack surfaces monitoring detection etc even current job able talk insightfully perspectives shows great awareness various fields interact violentpotatos man trying take exact path tbh almost felt wrote post forgot network engineer isp years helpdesk cybersecurity degree june gotten interview westerniron doesnt sound right many years fw experience violentpotatos working cisco asr ks since started ish years mikrotik smaller projects didnt resume bad ive brought rresumes general thumbs hard figure exactly list say resumes page noc logical physical backbone infas westerniron hmm likely lack security tool usage done compliance work design stuff would count ir apply mention violentpotatos unfortunately none professional level would negative closest design creating vlans routing isps worth traffic aside wiresharking network activity looking suspicious activity ive used variety tools education one offs hoping bachelors would help alas westerniron easy shift networking security often network engineers preferred candidates security many places mainly due fact security training skimps heavy networking new people security skill decent fw experience easy move people trained read analzye logs alerts hard find people say build vpn connection uses bgp fortigate properly build network segmentation yeetdesmartcontract want transition msears good transition isps great place learn serious networking also environment constantly attack spent career isps years long always thinking security tasks generally things though completely detailed orientated could get security cert security quite marketable either security position one bit caution operations isp environment strong focus get keep working also wear hat keep safe along two tenure cyber security isps besides technical skills needed diplomatic skills sell defend security often looked hinderance good luck xcite went business analyst security analyst yeah definitely possible id argue network security easier switch comes resume interview skills assuming infosec topics already thaddmitchell thing however much luck getting interview even grabbing certificates knowledge field lost track many times modified resume even paid someone help still struggling candidmolasses made shift ccie routing switching decade route switchnetsec experience prior hardest part learning risk management challenging move technical mindset risk management mindset move back technical mindset rkovelman network engineer exactly broad area large company
Fabrice Malware on PyPI Has Been Stealing AWS Credentials for 3 Years,jamessonnycrockett,InfoSecNews,2,1731005850.0,0,,
"""Encryption at Rest"" for Javascript.",Accurate-Screen8774,AskNetsec,1,1731052609.0,0,"I'm working on a javascript UI framework for personal projects and im trying to create something like a React-hook that handles ""encryption at rest"". the react-hook is described in more detail here (https://positive-intentions.com/blog/async-state-management). im using it as a solution for state-management. id like to extend its functionality to have encrypted persistant data. my approach is the following and it would be great if you could follow along and let me know if im doing something wrong. all advice is apprciated. im using indexedDB to store the data. i created some basic functionality to automatically persist and rehydrate data. im now investigating password-encrypting the data with javascript using the browser cryptography api. i have a PR here (https://github.com/positive-intentions/dim/pull/8) you can test out on codespaces or clone, but tldr: i encrypt before saving and decrypt when loading. this seems to be working as expected. i will also encrypt/decrypt the event listeners im using and this should keep it safe from anything like browser extensions from listening to events. the password is something never stored (not in a DB or local storage) the user will have to put in themselves to be able to decrypt the data. i havent created an input for this yet, so its hardcoded. this is then used to encrypt/decrypt the data. i would persist the unencrypted salt to indexedDB because this is then used to generate the key. i think i am almost done with this functionality, but id like advice on anything ive overlooked or things too keep-in-mind. id like to make the storage as secure as possible.",
Which antivirus software is good for Android phones? ,Suitable_Natural_415,antivirus,1,1731048272.0,4,"Hi, I don't understand much. I'm currently using Kaspersky Free. Should I change to another one? I hope it's free because I don't download it online very often. Thank you!",likeastar enough suitablenatural thankyou bunnyproplayz kaspersky good suitablenatural thank friend
Can someone please help me,Substantial-Shower-5,Sextortion,2,1731022752.0,4,I’m scared and I don’t know what to do I’m only just a kid. I know that I shouldn’t have but I was doing something inappropriate online and then the guy got a video that had my face in it and threatened to send it to people that I know. What are the chances of him actually doing this? I blocked him so he can’t talk to me anymore. Is there anything I can do to make sure he doesn’t send it to anyone? I am really scared and don’t know what to do.,increase email scams stating users hacked asking money ignore email says youve hacked personal information email might contain likely data breach bot action performed automatically please contact questions concerns please read post new victims please read first warningbeware recovery likely contacted recovery scammer parasites try convince hack scammer remove files devices please report comments report button hidden option receive dm please take screenshot forward mod team stay safe bot action performed automatically please contact questions concerns worthleadership time never send anyone good blocking private social medias even better deactivate personal number change substantialshower never phone number instagram discord privating instagram
Questions from a college student,AdhesivenessNo7543,forensics,1,1731011685.0,7,"Hi, I am currently in college, and for my current assignment, I have to interview someone in a career I am interested in doing after college. It would be better if I PM one of you guys since I am required to write down some personal information. I'm guessing it's so the professor knows we didn't just straight-up lie. Here are the questions Describe your typical work day. What do you enjoy most about your career and current position? What do you dislike about your career or current position? What challenges or barriers did you have to overcome to get into your career? What skills do you feel are most important for a position in this field? As a college student, what do I really need to know/do to have a successful entry into this career? Thank you to anyone that responds :)",automated response post might involve generic job title evidence tech forensic technician please include detailed description explanation job type question links job openings get taken disappear best include information int text box post also helps let us world advised properly bot action performed automatically please contact questions concerns mistisky feel free pm forensic scientistcsi unit director adhesivenessno thank pm later since work currently post automatically flaired might request general education please read guide wiki sidebar links resources question address needs please post recent education questions roundup offtopic tuesday forensic friday weekly discussion best results please include specific information world want go school country colleges schools interested degree programs career plan areas forensic science interested andor concentrations interest send modmail message changed post flair something else moderator release filters alternatively questions field questions professionals specific discipline questions please see ask forensic scientist threads request general education chosen wrong flair mistake please contact bot action performed automatically please contact questions concerns newraisin also pm youd different take dna analyst crime lab molecular biologist forensics specialist nonprofit left get phd forensics forensicguy also willing discuss day firearm toolmark examiner omygodc dm supervisor crime scene unit also served child porn task force arson task force homicide task force retired five years
Practice Images to load directly into Autopsy?,BlackflagsSFE,computerforensics,1,1731017574.0,0,"Hey guys. I was wondering if anyone knew where some test images or mock cases existed to load into Autopsy directly? I have been messing around with it, and don't have much experience with it. Most of my experience is AXIOM from college. I tried adding the python file for the .ad1 extension, but I was unsuccessful. If someone knows how exactly to add the extension to read .ad1 files in Autopsy, I would be GRATEFUL to be able to get it working. I have .e01 files from cases we did in school, however, something seems to always go wrong and it doesn't seem to parse the information correctly. The case I worked on that has the most information is the .ad1 file. I have read people talking about mounting the drive in FTK Imager and then loading it into Autopsy, but I am not at all sure how to do that, as we didn't delve into FTK too much. Anyways, if anyone can be of ANY help, I would appreciate it! Thanks so much! Edit: When I DO try to mount with FTK and process it into Autopsy, this is the error I get: https://imgur.com/a/nTPAd73",
