title,author,subreddit,score,created_utc,num_comments,selftext,comments
House fire death,mswilla,forensics,0,1730990193.0,9,My great uncle passed in a house fire. My parents have been told multiple times that the house is a crime scene. Is this normal for a house fire or indicative of something being suspicious? Google is not giving me the answer I’m looking for. Edited to add: he was 98 with no major medical issues. He was so badly burned that he is only identifiable by dental records. I am sick over the fact that he passed this way.,afewbabeslater theyre investigating fire started pretty standard much house fire forensic expert year criminal justice degree basically identify fire started started theyre gonna test accelerants stuff well basically looking abnormal fire pattern burning mswilla able go get information mom started living room burned entire middle house busted windows everything person called couch front front window fire sitting chair fire moving idea fire could started living roomcouch places guess let fire department determine mistisky forensic scientist yes shouldnt take long released speak arson investigator case details would ones holding scene mswilla detective speak investigation cousin great uncles power attorney cousin currently state hospital leukemia hopefully information next days thank taking time reply hearing crime scene seeing posts asking information fire called local pd concerned good probably routine yogurtclosetlong yes investigate cause fire already come conclusion may collecting evidence long ago happen mswilla yesterday afternoon mistisky clarify several days norm realized shouldnt long without clarifying sicsided fires ones fatalities fire marshall going respond investigate insurance well happens origin cause investigator hired insurance work public entities source believe origin fire usually hire company engineers certified engineer investigators show figure electrical mechanical items area put companies notice joint scene exam conducted interested parties evidence collected site left undetermined usually process released insured family sometimes happen quickly sometimes takes months today garage fire happened early september currently november th fatalities though usually get quicker omygodc house fire fatality takes time investigate arson investigators comb house looking ignition sources fire spread etc supervisor crime scene unit also part arson task force would document evidence arson investigators pointed collect evidence slow painstaking process especially since often comb water damage collect anything experience could day could three four days depends size house much house involved etc
NOT SURE IF THIS IS THE RIGHT PLACE TO ASK BUT: Unknown IP Used for Suspicious Login,Dayshinez,VPN,1,1731007081.0,2,"Hi everyone! Today, my grandpa asked me to check his Microsoft account because he received a notification about a password change (see the first picture). I decided to investigate by checking the IP address associated with this change to see if it matched his usual login location. It didn’t. Since he only uses his email on his laptop, it’s highly unlikely this login was his—especially as the IP location was in a very public place. He managed to reset his password (see the second picture) after some effort, which was fortunate. I’m not exactly an expert in IP tracking (or anything of the sort), and I’ve only recently started looking into this kind of issue, so I’m unsure if my concerns are completely justified. But I am worried: How could someone have accessed his account and changed the password? Could his data have been leaked? And are his other assets potentially at risk? Here’s what I’ve done so far to protect his account: 1. Changed his password. 2. Enabled two-factor authentication (2FA) for all logins. 3. Added my email as a backup recovery option in addition to his phone number. Can anyone advise on additional steps to ensure any of his other sensitive credentials and information is safe? Thanks in advance for any guidance.",trappedinvr used password email combination anywhere else change fust login attempt changing password turning fa fixed happened also ukrainian ips twice day changed password turned fa stopped probably bots checking leaked email addresses passwords trying sign check account valid see ihavebeenpwned email ever leaked
A confusing Tumblr ask,g_a_yyy_,Scams,1,1731050249.0,4,"I want to believe this is not a scammer though also hope this is a scam because I hate the reality of it all. I have 1 or 2 followers on this account and not many posts. If this is real I wouldn't be able to donate anyways but I'd like to know so I can warn other people. I have not clicked the link. As of writing this, I just recoeved a second email about a different ask that is similar in nature to this one but is someone else.",ugayyy message posted new submissions rscams please message new users beware posted start getting private messages saying professional hacker recovery expert lawyer help get money back small fee call recovery never take private always come form comments post open community keep eye take private reminder rules rscams contact information including last names phone numbers etc civil one another name calling insults personal army requests scammerscambaiting posts permitted uncensored gore personal photographs allowed without blurring full list rules available sidebar clicking help us reporting recovery rulebreaking content report button review reports also consider warning community members recovery see comments questions rules send us modmail clicking bot action performed automatically please contact questions concerns iserith yeah keep receiving slight variations names go fund pages images pages vitaminxzy sucks really cant believe someone reaches asking money donate legitimate transparent charities helping gaza instead cattywampus begging online instead street corner way knowing telling truth never trust strangers asking money genuinely wanting help others look reputable charities donate time money good
Google review manipulation?,Acrobatic_Bridge_249,Scams,2,1731036606.0,2,"A local company known for overcharging has thousands and thousands of reviews. Almost all positive. When I looked at the most recent reviews there were dozens where the review was posted the same day, but the business owner response was from months or years ago. I get that if a customer updates their reviews it might change the timestamp, but why are dozens of customers doing this daily?",uacrobaticbridge message posted new submissions rscams please message new users beware posted start getting private messages saying professional hacker recovery expert lawyer help get money back small fee call recovery never take private always come form comments post open community keep eye take private reminder rules rscams contact information including last names phone numbers etc civil one another name calling insults personal army requests scammerscambaiting posts permitted uncensored gore personal photographs allowed without blurring full list rules available sidebar clicking help us reporting recovery rulebreaking content report button review reports also consider warning community members recovery see comments questions rules send us modmail clicking bot action performed automatically please contact questions concerns psilocybinix theres lot people recreate fake google reviews
How to explain to my son the resell scam,24kdgolden,Scams,542,1730926960.0,104,"My son saw a user on TikTok who will ""teach"" him how to resell high ticket items like airpods, colognes, Burberry purses, etc. So my son paid XQRESELL to learn these secrets and then was referred to a ""vendor"" where he purchased airpods for $20 to resell for $150. The airpods are supposedly in transit. I asked my son why would a vendor sell him airpods for $20 so he could resell for $150 when the vendor could just skip the middleman and sell them for $150 himself? I told him I was skeptical if the airpods would even arrive and if they did come, they would be fake. It seems clear to me that this is a scam but how can I explain it better to my son? Maybe just wait for the airpods to never show it for knockoffs to arrive?",ukdgolden message posted new submissions rscams please message new users beware posted start getting private messages saying professional hacker recovery expert lawyer help get money back small fee call recovery never take private always come form comments post open community keep eye take private reminder rules rscams contact information including last names phone numbers etc civil one another name calling insults personal army requests scammerscambaiting posts permitted uncensored gore personal photographs allowed without blurring full list rules available sidebar clicking help us reporting recovery rulebreaking content report button review reports also consider warning community members recovery see comments questions rules send us modmail clicking bot action performed automatically please contact questions concerns oklingonberry son pays guy money end whole kdgolden agree guess nothing arrives believes seeyakid three kinds men one learns reading learn observation rest pee electric fence kdgolden see headed dweezil great opportunity teach empathy empathy often wrapped touchyfeely stuff people ignore strategic part tell new ipods sell walk might send random boy reasons might want say selling ipods stranger internet etc keep openended nonjudgmental rank reasons least likely compare things looking used airpods ebay seeing prices dodgergreen sure empathy plays certainly decent way impart lesson dweezil empathy putting someone elses shoes attempting understand feelings motivations usually used say maybe angry person traffic found cancer give grace also wait minute person thing something would never ever someone else really bad person least terms theyre dealing dodgergreen tried stretch reeallly far still didnt get lofty place apparently feel dweezil empathy compassion dodgergreen dictionary dweezil buy two comments dangermoose died theroguetrader case term empathy used attempt understand motivation feel compassion admit ive never previously seen term used quite dweezil yeah readily admit common interpretation people consider simply subset compassion find fairly limiting celinesjourney son learning lesson hard way marshalcrunch yes son buy electric fence kheyotecgoud theyll probably arrive itll cheap knockoff may may look real item likely standard run mill dropshipping cheap chinese crap good lesson business approach correctly droznig something else might happen something happens shipment something oops accidentally shipped many air pods held customs worry solution send money pay customs tax shipment released along many bonus airpods rich silly accident fortunate customs released shipment cant delivered excess balance paid worry cover cost send us cover remainder still rich endless problems endless solutions money person bled dry one stops saying doesnt always end nothing arrives theres whole levels far insidious seems surface level glance one paid money even makes far far likely get kdgolden ill keep eye ask delivery times zzady yes terribleawareness also paid learn pay someone get nothing return blastmix great part still wont believe leapyear easier fool people convince fooled mark twain doctorblue ive seen banker sometimes send legit package itll empty intentionally designed look tampered way claim stolen freight son try dispute bank problem card compromised zzady leave alone flakywedding reminds high school internetcell phones etc friend ordered book back magazine get rich book arrived book publish book sell magazines funniest thing ever technically cracked us willun cut bills half scissors arrive bubblebeez early send address self address stamped envelope money stuffing envelopes basically paper included self addressed stamped envelope place ad penny savers exactly one responded lololol back access info sent bill pmmecursedpics scams still around online courses emailperson air pods even arrive likely counterfeit selling counterfeit goods generally illegal well kdgolden told enemies selling fake goods healthypomelo knockoffs real nice connect phone displaying apple well way tell wiggle room case shake typically break months later seche beyond get seized customs cuz theyre coming china inspected ishittedinyourpants ask bought chinese website called something says yes bought counterfeit even connected iphone look legit theyre doublelxp pay sent credit card number probably best call cancel card kdgolden debit card ill lock card doublelxp better call cancel gave number kdgolden ill checknot sure called nothe defensive whole situation wouldnt want mom thing two lowdifficulty debit card fuck money gone tsdguy lesson even important never use debit card online transactions gives direct access real money us far less protection real chance never get money back minor control finances small limit credit card much better either guaranteed one one accounts monitor kdgolden minor obviously sophisticated hence credit card would max quickly much money card set decline insufficient funds overdraft fees tsdguy plenty credit cards budgeting features limit low credit lines also use privacy allows create temp credit cards various limits include type good purchases one time usage imho course cant learn unless use terrible habit get used used debit card browse sub uncountable number people use debit cards online lose money every day wont getting back kdgolden thanks ill check mostly familiar big discover student card obtusemongooseabuse check see bank secured credit card low value credit card put money order increase limit get credit limit paid full close credit card pay doesnt much sense normally building credit learning financial responsibility good option kdgolden thanks forgot secured cards morgondag sure correct unfortunate debit cards seems sounder model spend money already catjuggler step use debit cards anything atms plenty skimming etc opportunities drachenfuer debit seriously close account open new one trashpandanotacat debit card number next tons fraudulent charges sign sorts stuff referral links get referral contact bank asap shut card aa someone sells apple products living tell apple basically gives retailers low margin thier goods never sale everyone sells price typical margin bisexualcaveman dealer difference carrying cases charging cables aa actually money products upto margin rd party jinglemoon paid probably worth mtajvq old latenight infomercials flipping real estate would teach flip create competition could flip thesndmn creating online course time effort keep selling minimal marginal costs sell much wider market citizented looking solid investment opportunities first place go tiktok kdgolden get rich quickgotta support shoe habit lowdifficulty son thinks hes smart hes getting scammed kdgolden yes definitely thinks knows lowdifficulty proably found stuff thru whatsapp telegram tons scammer servers going night day bubblebeez oh good coming mysteriouspitch old son show sub comments post probably dozen posts similar scams last year find general thinking kinds things wouldnt fall idiots somehow special counting pambimbo listen sit explain seriously still denies buys falls deeper let lose money hard lesson money let money hands cards opi work vendor sells airpods gets directly apple around bucks sold notfsk tiktok generation logic doesnt really appeal unless explained second short million likes id sit back let happen either shitty knockoff doesnt come good luck selling either way son learn costly lesson dwinps son receive cheap replicas aka fake apple products participating fraudulent scheme defraud buyers livecourage probably find son filled w part process teach locking credit report also teaching dispute cc transactions taco cheap lesson learn feel everyone needs experience something life small amount avoid future kdgolden yes could absolutely worse smoothsecurity guess well spent teaches lookout future scams kindlygetmegiftcards sometimes parent job isnt prevent falling fall learn lesson consider letting play see learn kdgolden thanks gotta face consequences amphitheress video honest guide explains detail title tiktokers created teenage airpods resellers watch son kdgolden thank rowflysail even arrive tries resell hed scamming someone else passing cheap knock real thing ask feels good person euchre ask hes going deal us customs gets involved sells knockoff airpods law hes criminal selling counterfeit goods theyre counterfeit theyre stolen real airpods serialized apple knows wholesaler sold serials wholesale customer job serial documented sold retailer work retail sell airpods part scan every serial airpods sold come database sold bunch inventory shows sold reseller get cut ask hes going track report serials sells obviously son may excited addicted excitement accept hes duped saterp time tell course story tell daisygurl many buy different amazon sellers buying cheap goods alibaba sites marking resell kdgolden one broke crawlerado show scene tokyo drift lil bow wow getting ass kicked selling junk classmates duewolverine actually seen deep fake videos elon musk offering course making money obviously fake slow mechanical moving speaking bet lot people fell whats worse thread bet awards kind hip hop awards immediately made could targeting particular group hopefully careful barely believe anything see online anymore ingawolfie around long time good heavens remember falling child remember sending away via ad comic book flower vegetable seeds guaranteed sell immediately earn hefty profit eleven year old learned one quick surprised mother didnt send back spot learned quickly door door selling even suburb everyone knew everyone fools errand dad ended paying unsold seeds ended trash nose rubbed one yep electric fence emma explain air pods either come come either worth theyre likely son ripped needs learn losing sucks could lot resist urge tell told ziggo everyone focussing son getting scammed conversation son thinks okay try others kdgolden doesnt hes trying anyone believes airpods genuine item wistfuldrinker resell kdgolden saw one duewolverine tell simply sounds good true usually especially internet also explain get money quick adds pretty much false half truths see adds free medical money free cash cards government literally everyone would talking true finally money quick involves developing skill dedication professional get regular job honest respectable dependable eager learn doors open even mundane job could eventually read wealth someone sees values kdgolden went forex stuff wants believe best tell work duewolverine well learn slowly doesnt learn internet feeding ground looking someone doesnt knowledge recognize pretty honest person admit moments almost wanted try really people turning quick buck wont get rich though people learning careful anything funds changing hands net duewolverine could go back give advise years ago would find something really enjoy good employee someone people count trust really simple probably wouldnt wanted hear either back duewolverine money come starts start coming exponentially faster work way kdgolden thanks things sure never considered gargross life lesson something seems good true almost always robertetht apple way becoming trillion dollar company selling airpods etc middle men nope profit front retail magnumbull theres explain simply wait meantime tell son send money regardless tell might ask delivery fees shipment release fee something milk money shipment never arrive na removed tsdguy really sending people social media ripe scams bad idea scamsmodteam submission manually removed moderator following reason rule safety reasons posting sure review rules believe mistake feel free contact via modmail modmail way send regular dm single moderator please try appeal decision commenting notified probably miss posting exact thing may result temporary ban please review rules necessary changes doubt click appeal decision bot action performed manually please contact want appeal decision meetotherwise order form places alibaba healthy living buying items reselling waste time vendor dadofanaspieartist something good true prob kdgolden yep always told nothing free salttank son idiot kdgolden harsh uncalled
