title,author,subreddit,score,created_utc,num_comments,selftext,comments
"Interesting, high paying niches",Fit_Note_4910,cybersecurity,42,1731023127.0,34,"I’ve just started my cybersecurity career and wanted to get an idea of some high paying and interesting niches that I can work towards. Right now I do mainly AppSec and have some exposure in CloudSec, and I’m finding CloudSec quite interesting. I’d be interested in things on the automation side as well (did an internship in a DevOps role before), so something like DevSecOps sounds interesting, but from what I’ve seen it’s mainly focused on automation and less security. My goal is something in Silicon Valley where I’d be engaged but also be able to maintain a passable wlb. Any opinions on what and how to work towards those niches would be appreciated, thanks! Edit: When I say passable wlb, I mean just that: “passable”. As long as it’s not something like an hft with 60 hour work weeks I don’t mind.",spacegoblinyoda specialize incident response consulting absolutely love touch clients networks pretty niche everyone dealing folks true positive breachmalwarecryptolocker staff stressed csuite edge demanding none bothers provide good intel logs back everything much people satisfied damage done business network another story backup solutions tend sell point veeam paying handsomely side others find something enjoy become subject matter expert prosper started soc analyst large company grew dfir sorta second consulting enterprise incident response large software company incident commander role little bit less hands spent prior years dfir working alongside ir consultants little less hands sunset mostly except extreme cases whether enterprise consulting ir pays pretty well consulting faster pace lots different technologies enterprise slower vibe suits digging deep one orgs architecture lot friends consulting love spacegoblinyoda well put working soc service lots clients fast paced something new every day stay engaged work fuckomg cool tips minimizing stress naturally highstress situations andor others spacegoblinyoda biggest thing experience youve done something x perform function naturally youve seen cryptolockers behave environment wide variety situations scenarios different network architecture start mentally put things together quickly naturally get wrong started stressed fuck haha stuck used homelab extensively lots research outside work paid huge year things easier everyone burn lot folks really didnt anything fun computers used sooooo sick dealing daily goes job zookeepergamefit set boundaries realistic expectations learn communicate needs boss ask help look people boss time customers get good naturally build stress capacity crimsonnorseman pov veeam currently bestofbreed ransomware resilient backuprecovery spacegoblinyoda imo veeam best long time veeam engineer back sysadmin days bit biased man work good really cant go wrong smc backup solution ransomware resilient veeam either use scripts pull stored passwords encrypt backups outright delete also wipe cloud backups matter solution use offisiteoffline immutable going online protected mfa client wasabi without mfa actors emailed admins account telling delete buckets veeam awesome backup software though incorporate overall backup dr plan truly matters dirtyhamsandwich thinking career works wrong way many niche areas niche doesnt equal high compensation high compensation doesnt mean niche focus enjoy learn standout peers success factor number one understand high compensation less industry could god things cybersecurity work education chances highly compensated low vice versa could exceptional couple areas work financial services ton money probably doesnt feel amount money fixes going job every day loathe dishsoapeddishwasher first devsecops automation less security fact company even amazon google budget talent pool cover things instead goal treat security sre reduce toil non productive button clicking work focus entirely engineering efforts scale company automation platform engineering big part less security security way scales delivering product service internalexternal customers second niche jobs applying skillset example exploit development research appsec focusing fuzzing software analysis etc exact skills devsecops serious level applied differently best suggestion would hit sre devsecops appsec methodologies hard get strong foundation work anywhere intel cpu fuzzing amazon building highly distributed software analysis pipelines also wlb fast want promoted simply ground slave places go hugely past hours unless allow learning say correctly protect wlb source ex google ex amazon security engineering leadership years security engineering naturalmanufacturer great insight goal treat security sre reduce toil truth never spoken ganning learning say correctly protect wlb share examples kennedymutugijulius awesome insight generalgold typically people see looking highest paycheck coming mile away good aspect enjoy cyber money typically follow loupgaru right also rely single company keep top dollar good idea worth woaq icsot security basically security industrial critical infrastructure devices scada systems plcs computers control critical systems none devices built security mind vulnerable due outdated operating systems companies either unwilling unable accept risk time time amounts asset discovery asset management network segmentation devices also important running table tops business continuity disaster recovery ir teams sure attack outage happens ready building ir playbooks etc ics devices rarely targeted usually nation state actors attacking another nations power water supply critical stuff northernpossibility compliance vendor security reviews client response come mind sexy security job really sign days rarely check email hours take time feel bad ive worked field five years three companies laid made k college currently hovering around k working remote medium col area requires certain amount soft skills maybe politicking technical practitioners tend enjoy barrier entry lower hours good kennedymutugijulius hello link remote internships phdindrip really cybersec digital forensics law firms guy charging law firms k days work mildlyincoherent specific niche high level seceng work faang extraordinarily interesting lucrative solving complex ambiguous problems scale hopefully topics difference wlb youll fight though toomuchinfo testify expert digital forensics niche requires broad skill set including ability communicate technical information layperson audience addition exceptionally well room error hard get started requires dedication established excellent pay people work dotmar find niche love cybersecurity really want vendor risk management cyber risk management received multiple offers k third party auditing reviews big thing right numbers showing something incidents thirdparty related changingmyringtone happy advised otherwise dfir pretty niche deal mostly insurance referrals mentioned another commenter meet technical teams executives stressed demanding digging organisations pretty rewarding case load split roughly evenly ransomware business email compromise cases odd stolen laptop compromised website thrown dfir obviously entry level role although might find advertised time time benefit start somewhere soc specifically multitenant managed soc help desk cyber security lacks glamour youll see different orgs approach problems different perspectives philosophies youll also gain good understanding routine noise versus something requires attention teach use tools cant teach chocochipr low level linux software architects vp engineering pull base plus rsus dishsoapeddishwasher allmost always much lower base general k highest go without distinguished engineer title google meaning changed world computing stock bonus makes total comp google good year capital gains tax something roth ira means bank lot higher direct deposit amount hbx consider high paying terms oxjunkcod others irdfir pays handsomely accenture others pay k fully remote faang faang well known pain ratlsnake accenture paying kind money maybe senior smes best business model doesnt align numbers oxjunkcod k sign hype na deleted wickbam able get security clearance reasonably expect low figures without much experience though military background considered intermediate experience certifications especially comptia become important used dod entities baseline measures competence rightly wrongly years experience comptia cisco certs tssci reasonably expect around k baseline though might range high cola desolate bumfuck areas dryconsiderations nothing nice say leave comment keep dreaming dishsoapeddishwasher really put someone ask help toxic gate keeping crap ruining security industry tell others potential help find
I wrote my first (useless) security tool!,GutterSludge420,hacking,7,1731050858.0,2,"For the last 1.5 months I've been working on a blind sqli brute forcer. It still a bit messy, but it works, and its pretty darn fast to boot! I know sqlmap is one of the most reliable tools that pentesters use but i needed a project and this seemed like it was going to be within my skill set. I haven't done a project since college and I'm very pleased with myself for actually (mostly) finishing something. Please consider checking it out and giving me any feedback you have! The repo is here: https://github.com/c3llkn1ght/BlindBrute",redskullington damn right learning break apart rebuild cant check tn imma look tomorrow sure give much feedback ill def check congrats dude guttersludge wow thanks much still testing phases sure theres plenty bugs truly labor love ive learned hell lot boot started cybersec years ago scratch basically huge milestone
Win32.Trojan.Japaneno - A full Malware Analysis.,Astro-A26,computerforensics,3,1731016826.0,0,,
Is there an app where for all incoming calls it says “this call will be recorded please press 1 to continue” ,CookingMama2202,privacy,57,1731026283.0,41,I live in a 2 party consent state.,robonekov press staying call informed consent xprluh mean new ios update iphones ai assistant announces every time record calls call recording functionality built native additional apps needed scotbud rough things canada suck glad whole country party consent deadinmybed never heard one kind opposite privacy isnt mousedenton fits subject userlevel disclosure regarding would necessary twoparty consent states nidostan reddit privacy promoting things privacy could include talking things promote privacy take away ohscheisse subject still privacy consent optin process creating transparency hourad device protecting partys privacy cosmocafe android theres call recorders use one record calls another app upload cloud also android use tasker place scene screen display incoming call whenever call comes made buttons actions press accept cancel yes doable fact almost anything tasker ive way years returntoglory op asking way automatically notify caller get consent op may record call cosmocafe answered question response use tasker display scene call clevererer borrow callers phone ask install tasker call doesnt seem practical cosmocafe didnt say whose phone seems hes talking phone house use tasker play recording message caller hear probably use hear key pressed caller well beyond knowledge espumma theyre clearly trying ask permission party call clearly consent plans returntoglory control callers phone cosmocafe controls phone running op configure incoming hes receiver outgoing hes caller wont control someone elses phone returntoglory help op khaonyx caller phone able see screen accept deny cosmocafe didnt say whose phone seems hes talking phone house use tasker play recording message caller hear probably use hear key pressed caller well beyond knowledge certainly play message caller itll recorded fact android setting previous phone could record calls would always inform parties via voice recorded havent seen current phone though moved back call recorder mentioned doesnt announce recording thelinuxmailman youve great patience keep explaining great detail underpowered cpu generalnakedbutt physically accept deny stay line consent consent hang nidostan party could claim didnt hear whatever reason press key confirm makes iron clad generalnakedbutt every company call recording automated message corporate legal departments sign gonna fine nidostan well probably play devils advocate one could argue recording widely known even expected phoning big company different private number realm possibility person could distracted seconds miss although case maybe even would lose since judge might say fault neotokyo sources pulled ass beeper use record calls android cosmocafe call recorder smart mobile tools set forget years beeper thanks cosmocafe btw use onesync metactrlcom oneway upload recordings onedrive another setandforget app ive years versions cloud services incidentally day cleaning onedrive found calls recorded going back around thelinuxmailman onedrive scan content microsoft ai training beeper sorry couldnt get link work found voice recorder smart mobile tools app record sides conversation cosmocafe yes name comment thelinuxmailman see comments fossify phone fdroid store thelinuxmailman thanks readers rprivacy might want aware fossify phone floss fork simple mobile tools purchased private company available fdroid others private secure mobile operating system android app compatibility developed nonprofit open source project phone recording function built default aosp dialer johnsmith something simple recording call hard almost two decades ever since transition smart devices able record calls record normal audio take videos consent tech shouldve available two decades ago spiritualheight app use dangerbucatini android theres call recorders havent worked several versions since android stripped native call recording apis also went way fuck third party recorders johnsmith though benefit simply get believe big tech wanting control life cause record evidence evidence sue exercise rights sure big corpos rise eula forced arbitration etc dangerbucatini anything sinister incompetence google since readded first party voice recording still fucks third party afaik hardly enabled anywhere even places clearly legal theres obviously technical legal impediment theyre willing create feature believe simply neglect probably big serving wanting deal squabbledmc tech companies states washington state recording calls without informing caller illegal also private facetoface conversations video calls however else talk via voice someone else enforced state since simply informing caller recorded enough cover choose hang continue knowing recorded customer service hotlines tell theyre monitoring calls actually connecting person
BJORN - Alpha release! 🎉,Bright_Warning_8406,hacking,111,1730995207.0,11,,putridbananas someone tell captaindivano security tools pentesters hackers people wants open gate compound fndav android app captaindivano works rapsberries download google play store thqts mean oldopportunity hail b j r n whitelynx great way use raspberry pi pentesting might actually buy one never saw much use cool starting run space unused hardware room brightwarning crosspublication click original post get details link github bdtrp nice mndfvr waiting check asap mrtifiedpeng fucking sick dude intelwzard cool require hardcode wifi network creds first running
I'm a sextortion victim (M20),X3rthus_15,Sextortion,3,1731032410.0,8,So I was on tinder just swiping when suddenly I got matched with someone and she wanted to switch to telegram and I agreed. I'll admit that I was skeptical at first but for some reason her words seemed legit so I fall for it she called and turns out it's a guy and he screenshoted and screen recorded my face and my ykw as well as my Facebook profile. He initially asked for money it's kind of a little amount so I sent him (which I shouldn't) and he deleted the videos. But the screenshots costs another $50 to delete in which I did pay again ( I'm genuinely dumbfounded by my mistake). He deleted the photos after the payment has been made. However my only worry is for him to have backed up the photos and videos of me and post it. Reading this sub helped me. I already changed my name in my Facebook account and deleted my telegram. Trigger warning I almost took my own life last night. But I need to know what will I do if he posts it. Thank you for your tips,worthleadership listen man nothings gonna happen change privacy setttings facebook see friends list email phone number etc keep telegram deleted change phone number also case week half almost nothings happened even paid xrthus heshe also facebook social media well inthrowaway already friends list cyllyra report block recovery message hire fix company either glad didnt anything drastic messages social media account threatened leak demanded money report conversation comments best way get account dealt shut block copy images video threatening go new victim post create case stopncii file report ic go social media accounts private check settings one theres setting lets opt allowing account found search engines phone number email use set social account message settings allow friends people follow contact turn tags without approval changing profile picture username great helps feel better backup plan deactivate facebook tell sow people hacked reactivate whenever tell people able recover anything surface highly unlikely say hacker made ai pics account say hacker must gone chats found something sent person dated forgot even break still kinda embarrassing itll blow fast enough people would empathize risk leak low disappeared point transaction completed theres reason expected hang around motivated money gain nothing lose leverage leak likely keep eye see account comes back online try money cant get engage cant find online move eventually delete media phone number either change prepared report spam block anything coming anyone read receipt option turn answer unknown callers bother opening messages unknowns itd head games use imessages turning helps service providers option turn email text usually bypass blocks give engage xrthus hello scammer tried reach saying restore photos videos post university already deleted telegram account ways could prevent happening cyllyra trying reach social account phone text reading messages mind games get money block ghost completely engage post university another scare tactic copy images video threatening create case stopncii helps prevent posted online anywhere meta supports stopncii xrthus already deleted account hes trying contact however still scared since may expelled university admins knew mistake cyllyra wont expelled victim crime uni tried would open litigation unis oblivious scams ive read lot posts anyone reported leaked uni job rare times leak happens people visible friendfollow list unis much better internet security average person would also happy help authorities try track leaks came better resources successful blackmailers want easy money want big risks want evidence left place used charge trying contact account probably going worth peace mind change phone number able log mobile account
"This error popped up on my desktop randomly today, should I be worried much?",MenInAcrocious,antivirus,6,1731038921.0,3,,rainrat unusual update versions dll files might match since theres nothing description specifically seems malware questions could try rhoursupport rpchelp rtechsupport even chance malware unless something specific looking describing symptoms efficient way diagnose specific malware wed antivirus program log see list wiki analysis suspect file online scan site virustotal see web tools wiki welcome start new thread contains antivirus scan log online scan site link difficultbend search box taskbar type command prompt rightclick press hold command prompt desktop app list results select run administrator selectyes type dismexe online cleanupimage restorehealth note space press enter note step may take minutes start complete see message says operation completed successfully type sfc scannow note space sfc press enter see message says verification complete type exit press enter restart pc shouldnt worry remember worrying doesnt actually solve anything instead pause take deep breath might issue address preventative steps consider lets identify next steps instead worrying cant advise worried message informational purposes post removed reason anyone still reply bot action performed automatically please contact questions concerns
"Random device named ""David's S24"" was connected to my phone with no ""i"" and was unclickable? ",victorycar1,cybersecurity_help,2,1731026498.0,1,"Did someone manage to hack my phone via bluetooth connection? I was leaving the gym and sitting in my car, looking at my bluetooth page to connect to my car when I noticed a device connected to my phone with no way of tapping on it named ""S24 de David"" (French). When I tried tapping on it, it disappeared. https://imgur.com/a/mIfv1Ti DC Mini is my dashcam and car multimedia is my car. Am I cooked? I have an iPhone 11 on iOS 17.7. I don't see any new apps and haven't been notified about any new logins, and nothing suspicious has happened yet. Edit: I deleted all my saved passwords, reviewed what/who has access to what (through Apple's security check steps) and am now updating to iOS 17.7.1. Edit again: I had an Apple advisor run diagnostics on my phone and they didn't find any malware, at least. But I'm sure hackers can manage to remain hidden, right?",safety notice reddit protect posting asking help may targeted example heres stay safe never accept chat requests private messages invitations chatrooms encouragement contact person group reddit emails anyone reason moderation bots trusted community members cannot protect outside comment section post report chat requests messages get relation question report chats report messages report comments immediately report anyone promoting paid services friends soliciting kind payment assistance offered free absolutely strings attached anyone violating either scammer advertiser latter also forbidden good security matter paying enough never divulge secrets passwords recovery phrases keys personal information anyone reason answering cybersecurity questions resolving cybersecurity concerns never require give privacy security community volunteers comment post assist meantime sure post follows posting guide includes relevant information familiarize online scams rscams wiki bot action performed automatically please contact questions concerns
Hackers demand France’s Schneider Electric pay a $125k ransom in baguettes,VulnerableU,cybersecurity,171,1730991435.0,15,I’m not even mad,excitedfornothing cute gets press broadcast plans extort schneider electric well companies future transitioning hacktivism extortion good year schneider either second major breach calendar year yikes digmonsdrill ask payment baguettes actually want grasswaterdirthorse yeah ransoms quickly getting stale vordlader maybe croutons alad usualillustrator mon dieu blurblursotong hacker asked k without stating currencies french literally take theyre demanding baguettes grasswaterdirthorse hackers really want get bread olexc anyone latest claimed data would leaked today unless se acknowledged breach checked earlier still nothing several customers use se impacted first breach cactus hellcat new unsure legitimacy eta checked uploading tomorrow fun bellr could please let theres update olexc published according leak site havent checked yet though worldecho cant blame trying nothing better fresh baguette atempestsinister talk inflicting pain bughunter joke ytusul alotta dough leftonquietroad tell em fuck schneider
Bellingcat Filename Finder - Chrome Web Store,Such-Heat1674,OSINT,1,1731036258.0,0,Revealing the hidden name of the images on Google maps,
Advice needed,BandetteTrashPanda,Pentesting,2,1731051589.0,0,Hi fellow redditors. I was hoping someone might be able to give me a bit of help. My dream career is to become a pen tester. I'm currently in school for cyber security and have an IT background. How did you all get to your job? What advice do you have for someone like me who knows nothing or anyone already in the field.,
How Russia Openly Escalated Its Election Interference Efforts,DoremusJessup,ActiveMeasures,125,1731005920.0,8,,okvulva nothing done nothing done going suffering theyve done one even cares ijustloggedintosay last time everyone least decency outraged nothing time everyones ya expected normal point okvulva kind weird honestly pissed mrripley exactly great argument free speech speech full lies whats solution usefulhovercraft look moldova didnt even choose putins favorite americans dopes doremusjessup mirror link politicalcanvas year russia interfered usa election instead crilping sanctions usa rised export russia year reached peak since year year russia outright began threaten usa severe consequences withdraw nato east europe instead crilping sanctions usa noting years enormous list international law violations instead crilping sanctions usa years row gave russia time resurces natoeu spent years b russian export continuation escalation year another russian interference usa election instead crilping sanctions time trade nothing another stablization interference designeremu let eat cake
Ransomware Attack Causes Limited Disruptions for Texas-Based Newpark Resources,JCTopping,cybersecurity,15,1731039101.0,1,,ytusul sounds effective response plan place good reminder check plans consider various types impact critical business functions
Helping banish malicious adverts and drive a secure advertising ecosystem,digicat,blueteamsec,2,1731043956.0,0,,
